{
  "schema_version": 1,
  "app_id": "xconnect-vpn",
  "platform": "linux",
  "channel": "stable",
  "enabled": true,
  "latest": {
    "version": "0.1.0",
    "build": 1,
    "released_at": "2026-07-05T00:00:00Z",
    "minimum_supported_version": "0.1.0",
    "mandatory": false,
    "title": "XConnect VPN 0.1.0",
    "notes": "Initial Linux manifest for the XConnect VPN client.",
    "release_page": "https://github.com/svdkilla/XConnect_Client/releases/tag/v0.1.0",
    "artifacts": [
      {
        "type": "tar.gz",
        "arch": "x64",
        "url": "https://github.com/svdkilla/XConnect_Client/releases/download/v0.1.0/xconnect-vpn-linux-x64.tar.gz",
        "sha256": null,
        "size": null
      },
      {
        "type": "appimage",
        "arch": "x64",
        "url": "https://github.com/svdkilla/XConnect_Client/releases/download/v0.1.0/XConnectVPN-x86_64.AppImage",
        "sha256": null,
        "size": null
      }
    ]
  }
}
