{
  "schema_version": 1,
  "app_id": "xconnect-vpn",
  "platform": "web",
  "channel": "stable",
  "enabled": false,
  "latest": {
    "version": "0.1.0",
    "build": 1,
    "released_at": "2026-07-05T00:00:00Z",
    "minimum_supported_version": "0.1.0",
    "mandatory": false,
    "title": "XConnect VPN 0.1.0",
    "notes": "Web manifest placeholder.",
    "release_page": "https://github.com/svdkilla/XConnect_Client/releases/tag/v0.1.0",
    "artifacts": []
  }
}
