{
  "schema_version": 1,
  "app_id": "xconnect-vpn",
  "platform": "windows",
  "channel": "stable",
  "enabled": true,
  "latest": {
    "version": "0.1.2",
    "build": 2,
    "released_at": "2026-07-05T20:53:49Z",
    "minimum_supported_version": "0.1.0",
    "mandatory": false,
    "title": "XConnect VPN 0.1.1",
    "notes": "News feed, cabinet news API, and update banner.",
    "release_page": "https://github.com/svdkilla/XConnect_Client/releases/tag/v0.1.1",
    "artifacts": [
      {
        "type": "zip",
        "arch": "x64",
        "url": "https://raw.githubusercontent.com/svdkilla/XConnect_Client/main/artifacts/v0.1.1/windows/xconnect-vpn-windows-x64.zip",
        "sha256": "2494a8d9644840f1f889819dae290ef88da36013f51e62af05c9a947ff5048e7",
        "size": 42244670
      }
    ]
  }
}
