{
  "schema_version": 1,
  "app_id": "xconnect-vpn",
  "platform": "android",
  "channel": "stable",
  "enabled": true,
  "latest": {
    "version": "0.1.0",
    "build": 1,
    "released_at": "2026-07-05T00:00:00Z",
    "minimum_supported_version": "0.1.0",
    "mandatory": false,
    "title": "XConnect VPN 0.1.0",
    "notes": "Initial Android manifests for ARM devices.",
    "release_page": "https://github.com/svdkilla/XConnect_Client/releases/tag/v0.1.0",
    "artifacts": [
      {
        "type": "apk",
        "arch": "arm64-v8a",
        "url": "https://raw.githubusercontent.com/svdkilla/XConnect_Client/main/artifacts/v0.1.0/android/xconnect-vpn-android-arm64-v8a.apk",
        "sha256": "5e59cc2854b3530730128b69bca24a9538ca2a38fd8763c5d27bf8dfdab748e4",
        "size": 104683161
      },
      {
        "type": "apk",
        "arch": "armeabi-v7a",
        "url": "https://raw.githubusercontent.com/svdkilla/XConnect_Client/main/artifacts/v0.1.0/android/xconnect-vpn-android-armeabi-v7a.apk",
        "sha256": "f3ba05a47d08d32be72c2975ad858f6fc2205e0eea18d28ff8fb7a984b06cafb",
        "size": 98951887
      }
    ]
  }
}
