{
  "schema_version": 1,
  "app_id": "xconnect-vpn",
  "platform": "pc",
  "channel": "stable",
  "enabled": true,
  "latest": {
    "version": "0.1.0",
    "build": 1,
    "released_at": "2026-07-05T00:00:00Z",
    "minimum_supported_version": "0.1.0",
    "mandatory": false,
    "title": "XConnect VPN 0.1.0",
    "notes": "Desktop PC alias manifest. Currently points to the Windows x64 build.",
    "release_page": "https://github.com/svdkilla/XConnect_Client/releases/tag/v0.1.0",
    "artifacts": [
      {
        "type": "zip",
        "arch": "x64",
        "url": "https://github.com/svdkilla/XConnect_Client/releases/download/v0.1.0/xconnect-vpn-windows-x64.zip",
        "sha256": "7cb9c75b91ed377e4121ec0c8febae58d2779b751af2e6555361536bdac0c621",
        "size": 42226126
      }
    ]
  }
}
